<!ELEMENT activitats (activitat+)>

<!ELEMENT activitat (nom, monitor, horari?, participant+, lloc)>

<!ELEMENT nom (#PCDATA)>
<!ELEMENT monitor (#PCDATA)>
<!ELEMENT horari (#PCDATA)>
<!ELEMENT participant (#PCDATA)>

<!ELEMENT lloc (interior | exterior)>
<!ELEMENT interior (#PCDATA)>
<!ELEMENT exterior (#PCDATA)>

<!ATTLIST activitat 
          codi CDATA #REQUIRED
          tipus (esportiva | artistica) #REQUIRED>    